車両を駐車することはできません,(1)緊急時の高速道路の脇(2)赤く塗られた縁石の隣(3)小学校から100フィート以内
次の場合は、5日以内にDMVに通知する必要があります(1)車両を販売または譲渡します(2)車両のスモッグテストに不合格となります(3)レンズまたはコンタクトの新しい処方箋を入手した場合
2フィート以上離れた2組の実線の二重の黄色の線：(1)横断して、私道を出入りできます(2)何らかの理由で交差できません。(3)別の車線としてみなす必要があります。
次の交差点で右折したい。あなたは減速し、次の動作をする：(1)車線の左側に移動します(2)自転車レーンでの運転は避けてください(3)方向転換する100フィート前で合図
65MPHの高速道路を走行しています。車の流れは70MPHで移動しています。あなたが合法的に運転するには？：(1)車の流れの速度に追いつくために時速70マイル以上(2)65mphと70mphの間(3)65mphより速くない速度。
あなたの車を駐車することは違法です：(1)マークされていない横断歩道で(2)私道から3フィート以内(3)自転車レーン
携帯電話の使用と運転に関してあなたが取ることができる最も安全な予防策は次のとおりです(1)ハンドルを両手で握れるように、ハンズフリーデバイスを使用してください(2)道路から目を離す必要がないように、スマートフォンを手の届くところに置いてください(3)電話に出る前に番号を確認してください
青信号があるが、交通が交差点をブロックしている場合、次のことを行う必要があります(1)渋滞がなくなるまで交差点に近づかないでください(2)交差点に入り、渋滞がなくなるまで待ちます(3)別の車線に合流し、渋滞を回避してみてください
右折する準備が整いました。あなたがすべきこと：(1)信号を送ってすぐに曲がります(2)正しい車線に入る前に停止し、他のすべての交通を先に進みます。(3)必要に応じて、減速または停止してから方向転換します。
通学標識の指示に従ってください(1)常に(2)授業時間中のみ(3)子供がいる限り
とても風の強い日です。あなたが運転していて、砂嵐が高速道路で吹いていてあなたの視界を狭めています。あなたは慎重に運転して次のライトを入れるべきです：(1)車内ライト(2)駐車灯(3)ヘッドライト
別の車両を追い越す場合には、次のことを行う必要があります(1)他の運転手があなたが車線に戻るためのスペースを作るとは仮定しない(2)ウインカーを使用する場合、他のドライバーが通過を許可すると仮定します(3)他のドライバーが一定の速度を維持するとします
あなたは65mphに掲示された高速道路を運転しています。他のほとんどの車両は時速70マイル以上で運転しています。あなたが合法的に運転するには？：(1)トラフィックの速度に追いつくために時速70マイル以上ｓ(2)65mphと70mphの間(3)65mphより速くない
1車線道路で他の車よりも速く運転し、他の車を追い越し続けると、次のようになります。(1)あなたを速く、より安全に目的地に連れて行きます(2)事故の可能性を高めます(3)交通渋滞の防止に役立ちます
線路を横断する前に必ず停止しなければならない車両はどれですか(1)危険物プラカードでマークされたタンクローリー(2)トレーラーを牽引するモーターホームまたはピックアップトラック(3)3つ以上の車軸または4000ポンドを超える重量の車両
あなたは一方通行の道路を運転しています。次の場合に限り、左折して別の一方通行の道路に入れます(1)標識はターンを許可します(2)通りの交通は右に移動します(3)通りの交通は左に移動します
大型トラックが前方にあり、右折して2車線の道路に向かいます。トラックは：(1)2つのレーンのいずれかでターンを完了することができます。(2)右折を完了するには、車体を大きく振る場合があります(3)旋回中は常に右車線を走行する必要があります。
次の黄色い線の場合、黄色の二重線を越えて別の車両を通過できます(1)道路の反対側は実線です(2)道路の片側が破線です(3)道路の反対側は破線です
交差点、横断歩道、踏切では、常に次のことを行う必要があります(1)立ち止まり、耳を傾け、慎重に進んでください(2)車両の側面を見て、何が来るかを確認します(3)理由もなく停止しているように見える車両をゆっくり追い越します
次の場合、安全に運転できます(1)常にあなたと前方の車との間に1車間を置いてください(2)運転中は前の車だけを見てください(3)危険を探すために目を動かし続けてください
